Sheet: Inventory
A1: SB Seller | C1: T001
A2: Lease Inventory As At: | C2: Sep 30, 2013 | I2: BORROWER | N2: ACME
A4: # | B4: CONTRACT # | C4: CUST # | D4: MASTER | E4: INFOLEASE# | F4: CUSTOMER NAME | G4: CUSTOMER ADDR | H4: DOCUMENTATION | I4: TIER | J4: TIME IN | K4: LESS THAN 2 YEARS | L4: CONTRACT START | N4: SECURITIZED | O4: CAPITAL | P4: INSURANCE | Q4: DOWN | R4: PAYMENT | T4: INSURANCE | U4: LAST PAYMENT | V4: BALOON | W4: SOFT COST | X4: PAYMENT METHOD | Y4: WAREHOUSED | Z4: RE-FINANCE | AA4: PAYMENT DAY | AB4: CUSTOMER | AC4: CREDIT RISK | AD4: ASSET | AE4: ASSET | AF4: SERIAL | AG4: N/U | AH4: CONCENTRATION | AI4: CONCENTRATION | AJ4: CONCENTRATION | AK4: ASSET | AL4: INDUSTRY | AM4: SIC | AN4: NAICS | AO4: AR @ | AP4: NPV @ | AQ4: 2013-10-01T00:00:00.000 | AR4: 2013-11-01T00:00:00.000 | AS4: 2013-12-01T00:00:00.000 | AT4: 2014-01-01T00:00:00.000 | AU4: 2014-02-01T00:00:00.000 | AV4: 2014-03-01T00:00:00.000 | AW4: 2014-04-01T00:00:00.000 | AX4: 2014-05-01T00:00:00.000 | AY4: 2014-06-01T00:00:00.000 | AZ4: 2014-07-01T00:00:00.000 | BA4: 2014-08-01T00:00:00.000 | BB4: 2014-09-01T00:00:00.000 | BC4: 2014-10-01T00:00:00.000 | BD4: 2014-11-01T00:00:00.000 | BE4: 2014-12-01T00:00:00.000 | BF4: 2015-01-01T00:00:00.000 | BG4: 2015-02-01T00:00:00.000 | BH4: 2015-03-01T00:00:00.000 | BI4: 2015-04-01T00:00:00.000 | BJ4: 2015-05-01T00:00:00.000 | BK4: 2015-06-01T00:00:00.000 | BL4: 2015-07-01T00:00:00.000 | BM4: 2015-08-01T00:00:00.000 | BN4: 2015-09-01T00:00:00.000 | BO4: 2015-10-01T00:00:00.000 | BP4: 2015-11-01T00:00:00.000 | BQ4: 2015-12-01T00:00:00.000 | BR4: 2016-01-01T00:00:00.000 | BS4: 2016-02-01T00:00:00.000 | BT4: 2016-03-01T00:00:00.000 | BU4: 2016-04-01T00:00:00.000 | BV4: 2016-05-01T00:00:00.000 | BW4: 2016-06-01T00:00:00.000 | BX4: 2016-07-01T00:00:00.000 | BY4: 2016-08-01T00:00:00.000 | BZ4: 2016-09-01T00:00:00.000 | CA4: 2016-10-01T00:00:00.000 | CB4: 2016-11-01T00:00:00.000 | CC4: 2016-12-01T00:00:00.000 | CD4: 2017-01-01T00:00:00.000 | CE4: 2017-02-01T00:00:00.000 | CF4: 2017-03-01T00:00:00.000 | CG4: 2017-04-01T00:00:00.000 | CH4: 2017-05-01T00:00:00.000 | CI4: 2017-06-01T00:00:00.000 | CJ4: 2017-07-01T00:00:00.000 | CK4: 2017-08-01T00:00:00.000 | CL4: 2017-09-01T00:00:00.000 | CM4: 2017-10-01T00:00:00.000 | CN4: 2017-11-01T00:00:00.000 | CO4: 2017-12-01T00:00:00.000 | CP4: 2018-01-01T00:00:00.000 | CQ4: 2018-02-01T00:00:00.000 | CR4: 2018-03-01T00:00:00.000 | CS4: 2018-04-01T00:00:00.000 | CT4: 2018-05-01T00:00:00.000 | CU4: 2018-06-01T00:00:00.000 | CV4: 2018-07-01T00:00:00.000 | CW4: 2018-08-01T00:00:00.000 | CX4: 2018-09-01T00:00:00.000 | CY4: 2018-10-01T00:00:00.000 | CZ4: 2018-11-01T00:00:00.000 | DA4: 2018-12-01T00:00:00.000 | DB4: 2019-01-01T00:00:00.000 | DC4: 2019-02-01T00:00:00.000 | DD4: 2019-03-01T00:00:00.000 | DE4: 2019-04-01T00:00:00.000 | DF4: 2019-05-01T00:00:00.000 | DG4: 2019-06-01T00:00:00.000 | DH4: 2019-07-01T00:00:00.000 | DI4: 2019-08-01T00:00:00.000 | DJ4: 2019-09-01T00:00:00.000 | DK4: 2019-10-01T00:00:00.000 | DL4: 2019-11-01T00:00:00.000 | DM4: 2019-12-01T00:00:00.000 | DN4: 2020-01-01T00:00:00.000 | DO4: 2020-02-01T00:00:00.000 | DP4: 2020-03-01T00:00:00.000 | DQ4: 2020-04-01T00:00:00.000 | DR4: 2020-05-01T00:00:00.000 | DS4: 2020-06-01T00:00:00.000 | DT4: 2020-07-01T00:00:00.000 | DU4: 2020-08-01T00:00:00.000 | DV4: 2020-09-01T00:00:00.000 | DW4: 2020-10-01T00:00:00.000 | DX4: 2020-11-01T00:00:00.000 | DY4: 2020-12-01T00:00:00.000 | DZ4: 2021-01-01T00:00:00.000 | EA4: 2021-02-01T00:00:00.000 | EB4: 2021-03-01T00:00:00.000 | EC4: 2021-04-01T00:00:00.000 | ED4: 2021-05-01T00:00:00.000 | EE4: 2021-06-01T00:00:00.000 | EF4: 2021-07-01T00:00:00.000 | EG4: 2021-08-01T00:00:00.000 | EH4: 2021-09-01T00:00:00.000 | EI4: 2021-10-01T00:00:00.000 | EJ4: 2021-11-01T00:00:00.000 | EK4: 2021-12-01T00:00:00.000 | EL4: 2022-01-01T00:00:00.000 | EM4: 2022-02-01T00:00:00.000 | EN4: 2022-03-01T00:00:00.000 | EO4: 2022-04-01T00:00:00.000 | EP4: 2022-05-01T00:00:00.000 | EQ4: 2022-06-01T00:00:00.000 | ER4: 2022-07-01T00:00:00.000 | ES4: 2022-08-01T00:00:00.000 | ET4: 2022-09-01T00:00:00.000 | EU4: 2022-10-01T00:00:00.000 | EV4: 2022-11-01T00:00:00.000 | EW4: 2022-12-01T00:00:00.000 | EX4: 2023-01-01T00:00:00.000 | EY4: 2023-02-01T00:00:00.000 | EZ4: 2023-03-01T00:00:00.000 | FA4: 2023-04-01T00:00:00.000 | FB4: 2023-05-01T00:00:00.000 | FC4: 2023-06-01T00:00:00.000 | FD4: 2023-07-01T00:00:00.000 | FE4: 2023-08-01T00:00:00.000 | FF4: 2023-09-01T00:00:00.000 | FG4: 2023-10-01T00:00:00.000 | FH4: 2023-11-01T00:00:00.000 | FI4: 2023-12-01T00:00:00.000 | FJ4: 2024-01-01T00:00:00.000 | FK4: 2024-02-01T00:00:00.000 | FL4: 2024-03-01T00:00:00.000 | FM4: 2024-04-01T00:00:00.000 | FN4: 2024-05-01T00:00:00.000 | FO4: 2024-06-01T00:00:00.000 | FP4: 2024-07-01T00:00:00.000 | FQ4: 2024-08-01T00:00:00.000 | FR4: 2024-09-01T00:00:00.000 | FS4: 2024-10-01T00:00:00.000 | FT4: 2024-11-01T00:00:00.000 | FU4: 2024-12-01T00:00:00.000 | FV4: 2025-01-01T00:00:00.000 | FW4: 2025-02-01T00:00:00.000 | FX4: 2025-03-01T00:00:00.000 | FY4: 2025-04-01T00:00:00.000 | FZ4: 2025-05-01T00:00:00.000 | GA4: 2025-06-01T00:00:00.000 | GB4: 2025-07-01T00:00:00.000 | GC4: 2025-08-01T00:00:00.000 | GD4: 2025-09-01T00:00:00.000 | GE4: 2025-10-01T00:00:00.000 | GF4: 2025-11-01T00:00:00.000 | GG4: 2025-12-01T00:00:00.000 | GH4: 2026-01-01T00:00:00.000 | GI4: 2026-02-01T00:00:00.000 | GJ4: 2026-03-01T00:00:00.000 | GK4: 2026-04-01T00:00:00.000 | GL4: 2026-05-01T00:00:00.000 | GM4: 2026-06-01T00:00:00.000 | GN4: 2026-07-01T00:00:00.000 | GO4: 2026-08-01T00:00:00.000 | GP4: 2026-09-01T00:00:00.000 | GQ4: 2026-10-01T00:00:00.000 | GR4: 2026-11-01T00:00:00.000 | GS4: 2026-12-01T00:00:00.000 | GT4: 2027-01-01T00:00:00.000 | GU4: 2027-02-01T00:00:00.000 | GV4: 2027-03-01T00:00:00.000 | GW4: 2027-04-01T00:00:00.000 | GX4: 2027-05-01T00:00:00.000 | GY4: 2027-06-01T00:00:00.000 | GZ4: 2027-07-01T00:00:00.000 | HA4: 2027-08-01T00:00:00.000 | HB4: 2027-09-01T00:00:00.000 | HC4: 2027-10-01T00:00:00.000 | HD4: 2027-11-01T00:00:00.000 | HE4: 2027-12-01T00:00:00.000 | HF4: 2028-01-01T00:00:00.000 | HG4: 2028-02-01T00:00:00.000 | HH4: 2028-03-01T00:00:00.000 | HI4: 2028-04-01T00:00:00.000 | HJ4: 2028-05-01T00:00:00.000 | HK4: 2028-06-01T00:00:00.000 | HL4: 2028-07-01T00:00:00.000 | HM4: 2028-08-01T00:00:00.000 | HN4: 2028-09-01T00:00:00.000 | HO4: 2028-10-01T00:00:00.000
D5: GROUP # | H5: ORIGINAL/ELECTRONIC | J5: BUSINESS | K5: INDUSTRY EXPERIENCE | L5: DATE | M5: TERM | N5: TERM | O5: COST | P5: PREMIUM | Q5: PAYMENT | R5: STRUCTURE | S5: MONTHLY PAYMENT | T5: PAYMENT | U5: IN ADVANCE | V5: RESIDUAL | W5: EXCEED 10% | X5: (PAP OR NOT) | Z5: RESTRUCTURE | AB5: RATE | AC5: CATEGORY | AD5: LOCATION | AE5: DESCRIPTION | AG5: N/U | AH5: -ASSET | AI5: -INDUSTRY | AJ5: -OTHER | AK5: CODE | AL5: CODE | AM5: CODE | AN5: CODE | AO5: Sep 30, 2013 | AP5: 0.04
A6: 1 | B6: 12441 | C6: TRA009 | F6: Customer 1 | L6: 01 Aug 2012 | M6: 66 | N6: 0 | O6: 277944.15999999997 | P6: 0 | Q6: 0 | R6: U | S6: 5463.5 | T6: 0 | V6: 0 | AA6: 0 | AB6: 0 | AO6: 284102 | AP6: 261313.69974879001 | AQ6: 5463.5 | AR6: 5463.5 | AS6: 5463.5 | AT6: 5463.5 | AU6: 5463.5 | AV6: 5463.5 | AW6: 5463.5 | AX6: 5463.5 | AY6: 5463.5 | AZ6: 5463.5 | BA6: 5463.5 | BB6: 5463.5 | BC6: 5463.5 | BD6: 5463.5 | BE6: 5463.5 | BF6: 5463.5 | BG6: 5463.5 | BH6: 5463.5 | BI6: 5463.5 | BJ6: 5463.5 | BK6: 5463.5 | BL6: 5463.5 | BM6: 5463.5 | BN6: 5463.5 | BO6: 5463.5 | BP6: 5463.5 | BQ6: 5463.5 | BR6: 5463.5 | BS6: 5463.5 | BT6: 5463.5 | BU6: 5463.5 | BV6: 5463.5 | BW6: 5463.5 | BX6: 5463.5 | BY6: 5463.5 | BZ6: 5463.5 | CA6: 5463.5 | CB6: 5463.5 | CC6: 5463.5 | CD6: 5463.5 | CE6: 5463.5 | CF6: 5463.5 | CG6: 5463.5 | CH6: 5463.5 | CI6: 5463.5 | CJ6: 5463.5 | CK6: 5463.5 | CL6: 5463.5 | CM6: 5463.5 | CN6: 5463.5 | CO6: 5463.5 | CP6: 5463.5
A7: =R[-1]C+1 -> 2 | B7: 12458 | C7: WES007 | F7: Customer 2 | L7: 01 Sep 2012 | M7: 39 | N7: 0 | O7: 28600 | P7: 0 | Q7: 0 | R7: U | S7: 917.56 | T7: 0 | V7: 0 | AA7: 0 | AB7: 0 | AO7: 23856.560000000001 | AP7: 22891.674781850001 | AQ7: 917.56 | AR7: 917.56 | AS7: 917.56 | AT7: 917.56 | AU7: 917.56 | AV7: 917.56 | AW7: 917.56 | AX7: 917.56 | AY7: 917.56 | AZ7: 917.56 | BA7: 917.56 | BB7: 917.56 | BC7: 917.56 | BD7: 917.56 | BE7: 917.56 | BF7: 917.56 | BG7: 917.56 | BH7: 917.56 | BI7: 917.56 | BJ7: 917.56 | BK7: 917.56 | BL7: 917.56 | BM7: 917.56 | BN7: 917.56 | BO7: 917.56 | BP7: 917.56
A8: =R[-1]C+1 -> 3 | B8: 12477 | C8: SBS001 | F8: Customer 3 | L8: 01 Oct 2012 | M8: 42 | N8: 0 | O8: 107957.5 | P8: 0 | Q8: 0 | R8: U | S8: 2983.62 | T8: 0 | V8: 0 | AA8: 0 | AB8: 0 | AO8: 89508.6 | AP8: 85327.478301609997 | AQ8: 2983.62 | AR8: 2983.62 | AS8: 2983.62 | AT8: 2983.62 | AU8: 2983.62 | AV8: 2983.62 | AW8: 2983.62 | AX8: 2983.62 | AY8: 2983.62 | AZ8: 2983.62 | BA8: 2983.62 | BB8: 2983.62 | BC8: 2983.62 | BD8: 2983.62 | BE8: 2983.62 | BF8: 2983.62 | BG8: 2983.62 | BH8: 2983.62 | BI8: 2983.62 | BJ8: 2983.62 | BK8: 2983.62 | BL8: 2983.62 | BM8: 2983.62 | BN8: 2983.62 | BO8: 2983.62 | BP8: 2983.62 | BQ8: 2983.62 | BR8: 2983.62 | BS8: 2983.62 | BT8: 2983.62
A9: =R[-1]C+1 -> 4 | B9: 12480 | C9: 142010 | F9: Customer 4 | L9: 15 Sep 2012 | M9: 36 | N9: 0 | O9: 74150 | P9: 0 | Q9: 0 | R9: U | S9: 2267.56 | T9: 0 | V9: 0 | AA9: 0 | AB9: 0 | AO9: 54421.440000000002 | AP9: 52392.000252450001 | AQ9: 2267.56 | AR9: 2267.56 | AS9: 2267.56 | AT9: 2267.56 | AU9: 2267.56 | AV9: 2267.56 | AW9: 2267.56 | AX9: 2267.56 | AY9: 2267.56 | AZ9: 2267.56 | BA9: 2267.56 | BB9: 2267.56 | BC9: 2267.56 | BD9: 2267.56 | BE9: 2267.56 | BF9: 2267.56 | BG9: 2267.56 | BH9: 2267.56 | BI9: 2267.56 | BJ9: 2267.56 | BK9: 2267.56 | BL9: 2267.56 | BM9: 2267.56 | BN9: 2267.56
A10: =R[-1]C+1 -> 5 | B10: 12481 | C10: 202012 | F10: Customer 5 | L10: 15 Sep 2012 | M10: 39 | N10: 0 | O10: 122613.68 | P10: 0 | Q10: 0 | R10: U | S10: 3982.45 | T10: 0 | V10: 0 | AA10: 0 | AB10: 0 | AO10: 107526.15 | AP10: 103008.21032752001 | AQ10: 3982.45 | AR10: 3982.45 | AS10: 3982.45 | AT10: 3982.45 | AU10: 3982.45 | AV10: 3982.45 | AW10: 3982.45 | AX10: 3982.45 | AY10: 3982.45 | AZ10: 3982.45 | BA10: 3982.45 | BB10: 3982.45 | BC10: 3982.45 | BD10: 3982.45 | BE10: 3982.45 | BF10: 3982.45 | BG10: 3982.45 | BH10: 3982.45 | BI10: 3982.45 | BJ10: 3982.45 | BK10: 3982.45 | BL10: 3982.45 | BM10: 3982.45 | BN10: 3982.45 | BO10: 3982.45 | BP10: 3982.45 | BQ10: 3982.45
A11: =R[-1]C+1 -> 6 | B11: 12483 | C11: SUL001 | F11: Customer 6 | L11: 01 Oct 2012 | M11: 39 | N11: 0 | O11: 105787 | P11: 0 | Q11: 0 | R11: U | S11: 3020 | T11: 0 | V11: 0 | AA11: 0 | AB11: 0 | AO11: 81540 | AP11: 78113.923637240005 | AQ11: 3020 | AR11: 3020 | AS11: 3020 | AT11: 3020 | AU11: 3020 | AV11: 3020 | AW11: 3020 | AX11: 3020 | AY11: 3020 | AZ11: 3020 | BA11: 3020 | BB11: 3020 | BC11: 3020 | BD11: 3020 | BE11: 3020 | BF11: 3020 | BG11: 3020 | BH11: 3020 | BI11: 3020 | BJ11: 3020 | BK11: 3020 | BL11: 3020 | BM11: 3020 | BN11: 3020 | BO11: 3020 | BP11: 3020 | BQ11: 3020
A12: =R[-1]C+1 -> 7 | B12: 12485 | C12: DEL003 | F12: Customer 7 | L12: 01 Oct 2012 | M12: 52 | N12: 0 | O12: 63765 | P12: 0 | Q12: 0 | R12: U | S12: 1440.94 | T12: 0 | V12: 0 | AA12: 0 | AB12: 0 | AO12: 57637.599999999999 | AP12: 54056.020983330003 | AQ12: 1440.94 | AR12: 1440.94 | AS12: 1440.94 | AT12: 1440.94 | AU12: 1440.94 | AV12: 1440.94 | AW12: 1440.94 | AX12: 1440.94 | AY12: 1440.94 | AZ12: 1440.94 | BA12: 1440.94 | BB12: 1440.94 | BC12: 1440.94 | BD12: 1440.94 | BE12: 1440.94 | BF12: 1440.94 | BG12: 1440.94 | BH12: 1440.94 | BI12: 1440.94 | BJ12: 1440.94 | BK12: 1440.94 | BL12: 1440.94 | BM12: 1440.94 | BN12: 1440.94 | BO12: 1440.94 | BP12: 1440.94 | BQ12: 1440.94 | BR12: 1440.94 | BS12: 1440.94 | BT12: 1440.94 | BU12: 1440.94 | BV12: 1440.94 | BW12: 1440.94 | BX12: 1440.94 | BY12: 1440.94 | BZ12: 1440.94 | CA12: 1440.94 | CB12: 1440.94 | CC12: 1440.94 | CD12: 1440.94
A13: =R[-1]C+1 -> 8 | B13: 12486 | C13: GAS002 | F13: Customer 8 | L13: 01 Oct 2012 | M13: 52 | N13: 0 | O13: 67580 | P13: 0 | Q13: 0 | R13: U | S13: 1611.46 | T13: 0 | V13: 0 | AA13: 0 | AB13: 0 | AO13: 64458.400000000001 | AP13: 60452.979009369999 | AQ13: 1611.46 | AR13: 1611.46 | AS13: 1611.46 | AT13: 1611.46 | AU13: 1611.46 | AV13: 1611.46 | AW13: 1611.46 | AX13: 1611.46 | AY13: 1611.46 | AZ13: 1611.46 | BA13: 1611.46 | BB13: 1611.46 | BC13: 1611.46 | BD13: 1611.46 | BE13: 1611.46 | BF13: 1611.46 | BG13: 1611.46 | BH13: 1611.46 | BI13: 1611.46 | BJ13: 1611.46 | BK13: 1611.46 | BL13: 1611.46 | BM13: 1611.46 | BN13: 1611.46 | BO13: 1611.46 | BP13: 1611.46 | BQ13: 1611.46 | BR13: 1611.46 | BS13: 1611.46 | BT13: 1611.46 | BU13: 1611.46 | BV13: 1611.46 | BW13: 1611.46 | BX13: 1611.46 | BY13: 1611.46 | BZ13: 1611.46 | CA13: 1611.46 | CB13: 1611.46 | CC13: 1611.46 | CD13: 1611.46
A14: =R[-1]C+1 -> 9 | B14: 12487 | C14: 157004 | F14: Customer 9 | L14: 01 Oct 2012 | M14: 52 | N14: 0 | O14: 97107.5 | P14: 0 | Q14: 0 | R14: U | S14: 2276.3000000000002 | T14: 0 | V14: 0 | AA14: 0 | AB14: 0 | AO14: 91052 | AP14: 85394.062601059995 | AQ14: 2276.3000000000002 | AR14: 2276.3000000000002 | AS14: 2276.3000000000002 | AT14: 2276.3000000000002 | AU14: 2276.3000000000002 | AV14: 2276.3000000000002 | AW14: 2276.3000000000002 | AX14: 2276.3000000000002 | AY14: 2276.3000000000002 | AZ14: 2276.3000000000002 | BA14: 2276.3000000000002 | BB14: 2276.3000000000002 | BC14: 2276.3000000000002 | BD14: 2276.3000000000002 | BE14: 2276.3000000000002 | BF14: 2276.3000000000002 | BG14: 2276.3000000000002 | BH14: 2276.3000000000002 | BI14: 2276.3000000000002 | BJ14: 2276.3000000000002 | BK14: 2276.3000000000002 | BL14: 2276.3000000000002 | BM14: 2276.3000000000002 | BN14: 2276.3000000000002 | BO14: 2276.3000000000002 | BP14: 2276.3000000000002 | BQ14: 2276.3000000000002 | BR14: 2276.3000000000002 | BS14: 2276.3000000000002 | BT14: 2276.3000000000002 | BU14: 2276.3000000000002 | BV14: 2276.3000000000002 | BW14: 2276.3000000000002 | BX14: 2276.3000000000002 | BY14: 2276.3000000000002 | BZ14: 2276.3000000000002 | CA14: 2276.3000000000002 | CB14: 2276.3000000000002 | CC14: 2276.3000000000002 | CD14: 2276.3000000000002
A15: =R[-1]C+1 -> 10 | B15: 12488 | C15: NOE001 | F15: Customer 10 | L15: 01 Oct 2012 | M15: 39 | N15: 0 | O15: 211299.37 | P15: 0 | Q15: 0 | R15: U | S15: 6820.72 | T15: 0 | V15: 0 | AA15: 0 | AB15: 0 | AO15: 184159.44 | AP15: 176421.58981157999 | AQ15: 6820.72 | AR15: 6820.72 | AS15: 6820.72 | AT15: 6820.72 | AU15: 6820.72 | AV15: 6820.72 | AW15: 6820.72 | AX15: 6820.72 | AY15: 6820.72 | AZ15: 6820.72 | BA15: 6820.72 | BB15: 6820.72 | BC15: 6820.72 | BD15: 6820.72 | BE15: 6820.72 | BF15: 6820.72 | BG15: 6820.72 | BH15: 6820.72 | BI15: 6820.72 | BJ15: 6820.72 | BK15: 6820.72 | BL15: 6820.72 | BM15: 6820.72 | BN15: 6820.72 | BO15: 6820.72 | BP15: 6820.72 | BQ15: 6820.72
A16: =R[-1]C+1 -> 11 | B16: 12496 | C16: SCH002 | F16: Customer 11 | L16: 01 Oct 2012 | M16: 39 | N16: 0 | O16: 36349.57 | P16: 0 | Q16: 0 | R16: U | S16: 982.23 | T16: 0 | V16: 0 | AA16: 0 | AB16: 0 | AO16: 26520.21 | AP16: 25405.907024569999 | AQ16: 982.23 | AR16: 982.23 | AS16: 982.23 | AT16: 982.23 | AU16: 982.23 | AV16: 982.23 | AW16: 982.23 | AX16: 982.23 | AY16: 982.23 | AZ16: 982.23 | BA16: 982.23 | BB16: 982.23 | BC16: 982.23 | BD16: 982.23 | BE16: 982.23 | BF16: 982.23 | BG16: 982.23 | BH16: 982.23 | BI16: 982.23 | BJ16: 982.23 | BK16: 982.23 | BL16: 982.23 | BM16: 982.23 | BN16: 982.23 | BO16: 982.23 | BP16: 982.23 | BQ16: 982.23
A17: =R[-1]C+1 -> 12 | B17: 12502 | C17: 621001 | F17: Customer 12 | L17: 01 Oct 2012 | M17: 43 | N17: 0 | O17: 36869.25 | P17: 0 | Q17: 0 | R17: U | S17: 1027.19 | T17: 0 | V17: 0 | AA17: 0 | AB17: 0 | AO17: 31842.89 | AP17: 30305.832930780001 | AQ17: 1027.19 | AR17: 1027.19 | AS17: 1027.19 | AT17: 1027.19 | AU17: 1027.19 | AV17: 1027.19 | AW17: 1027.19 | AX17: 1027.19 | AY17: 1027.19 | AZ17: 1027.19 | BA17: 1027.19 | BB17: 1027.19 | BC17: 1027.19 | BD17: 1027.19 | BE17: 1027.19 | BF17: 1027.19 | BG17: 1027.19 | BH17: 1027.19 | BI17: 1027.19 | BJ17: 1027.19 | BK17: 1027.19 | BL17: 1027.19 | BM17: 1027.19 | BN17: 1027.19 | BO17: 1027.19 | BP17: 1027.19 | BQ17: 1027.19 | BR17: 1027.19 | BS17: 1027.19 | BT17: 1027.19 | BU17: 1027.19
A19: =COUNT(R[-13]C:R[-2]C) -> 12 | O19: =SUM(R[-13]C:R[-2]C) -> 1230023.03 | Q19: =SUM(R[-13]C:R[-2]C) -> 0 | S19: =SUM(R[-13]C:R[-2]C) -> 32793.53 | V19: =SUM(R[-13]C:R[-2]C) -> 0 | AO19: =SUM(R[-13]C:R[-2]C) -> 1096625.2899999998 | AP19: =SUM(R[-13]C:R[-2]C) -> 1035083.37941015 | AQ19: =SUM(R[-13]C:R[-2]C) -> 32793.53 | AR19: =SUM(R[-13]C:R[-2]C) -> 32793.53 | AS19: =SUM(R[-13]C:R[-2]C) -> 32793.53 | AT19: =SUM(R[-13]C:R[-2]C) -> 32793.53 | AU19: =SUM(R[-13]C:R[-2]C) -> 32793.53 | AV19: =SUM(R[-13]C:R[-2]C) -> 32793.53 | AW19: =SUM(R[-13]C:R[-2]C) -> 32793.53 | AX19: =SUM(R[-13]C:R[-2]C) -> 32793.53 | AY19: =SUM(R[-13]C:R[-2]C) -> 32793.53 | AZ19: =SUM(R[-13]C:R[-2]C) -> 32793.53 | BA19: =SUM(R[-13]C:R[-2]C) -> 32793.53 | BB19: =SUM(R[-13]C:R[-2]C) -> 32793.53 | BC19: =SUM(R[-13]C:R[-2]C) -> 32793.53 | BD19: =SUM(R[-13]C:R[-2]C) -> 32793.53 | BE19: =SUM(R[-13]C:R[-2]C) -> 32793.53 | BF19: =SUM(R[-13]C:R[-2]C) -> 32793.53 | BG19: =SUM(R[-13]C:R[-2]C) -> 32793.53 | BH19: =SUM(R[-13]C:R[-2]C) -> 32793.53 | BI19: =SUM(R[-13]C:R[-2]C) -> 32793.53 | BJ19: =SUM(R[-13]C:R[-2]C) -> 32793.53 | BK19: =SUM(R[-13]C:R[-2]C) -> 32793.53 | BL19: =SUM(R[-13]C:R[-2]C) -> 32793.53 | BM19: =SUM(R[-13]C:R[-2]C) -> 32793.53 | BN19: =SUM(R[-13]C:R[-2]C) -> 32793.53 | BO19: =SUM(R[-13]C:R[-2]C) -> 30525.969999999998 | BP19: =SUM(R[-13]C:R[-2]C) -> 30525.969999999998 | BQ19: =SUM(R[-13]C:R[-2]C) -> 29608.409999999996 | BR19: =SUM(R[-13]C:R[-2]C) -> 14803.01 | BS19: =SUM(R[-13]C:R[-2]C) -> 14803.01 | BT19: =SUM(R[-13]C:R[-2]C) -> 14803.01 | BU19: =SUM(R[-13]C:R[-2]C) -> 11819.390000000001 | BV19: =SUM(R[-13]C:R[-2]C) -> 10792.2 | BW19: =SUM(R[-13]C:R[-2]C) -> 10792.2 | BX19: =SUM(R[-13]C:R[-2]C) -> 10792.2 | BY19: =SUM(R[-13]C:R[-2]C) -> 10792.2 | BZ19: =SUM(R[-13]C:R[-2]C) -> 10792.2 | CA19: =SUM(R[-13]C:R[-2]C) -> 10792.2 | CB19: =SUM(R[-13]C:R[-2]C) -> 10792.2 | CC19: =SUM(R[-13]C:R[-2]C) -> 10792.2 | CD19: =SUM(R[-13]C:R[-2]C) -> 10792.2 | CE19: =SUM(R[-13]C:R[-2]C) -> 5463.5 | CF19: =SUM(R[-13]C:R[-2]C) -> 5463.5 | CG19: =SUM(R[-13]C:R[-2]C) -> 5463.5 | CH19: =SUM(R[-13]C:R[-2]C) -> 5463.5 | CI19: =SUM(R[-13]C:R[-2]C) -> 5463.5 | CJ19: =SUM(R[-13]C:R[-2]C) -> 5463.5 | CK19: =SUM(R[-13]C:R[-2]C) -> 5463.5 | CL19: =SUM(R[-13]C:R[-2]C) -> 5463.5 | CM19: =SUM(R[-13]C:R[-2]C) -> 5463.5 | CN19: =SUM(R[-13]C:R[-2]C) -> 5463.5 | CO19: =SUM(R[-13]C:R[-2]C) -> 5463.5 | CP19: =SUM(R[-13]C:R[-2]C) -> 5463.5 | CQ19: =SUM(R[-13]C:R[-2]C) -> 0 | CR19: =SUM(R[-13]C:R[-2]C) -> 0 | CS19: =SUM(R[-13]C:R[-2]C) -> 0 | CT19: =SUM(R[-13]C:R[-2]C) -> 0 | CU19: =SUM(R[-13]C:R[-2]C) -> 0 | CV19: =SUM(R[-13]C:R[-2]C) -> 0 | CW19: =SUM(R[-13]C:R[-2]C) -> 0 | CX19: =SUM(R[-13]C:R[-2]C) -> 0 | CY19: =SUM(R[-13]C:R[-2]C) -> 0 | CZ19: =SUM(R[-13]C:R[-2]C) -> 0 | DA19: =SUM(R[-13]C:R[-2]C) -> 0 | DB19: =SUM(R[-13]C:R[-2]C) -> 0 | DC19: =SUM(R[-13]C:R[-2]C) -> 0 | DD19: =SUM(R[-13]C:R[-2]C) -> 0 | DE19: =SUM(R[-13]C:R[-2]C) -> 0 | DF19: =SUM(R[-13]C:R[-2]C) -> 0 | DG19: =SUM(R[-13]C:R[-2]C) -> 0 | DH19: =SUM(R[-13]C:R[-2]C) -> 0 | DI19: =SUM(R[-13]C:R[-2]C) -> 0 | DJ19: =SUM(R[-13]C:R[-2]C) -> 0 | DK19: =SUM(R[-13]C:R[-2]C) -> 0 | DL19: =SUM(R[-13]C:R[-2]C) -> 0 | DM19: =SUM(R[-13]C:R[-2]C) -> 0 | DN19: =SUM(R[-13]C:R[-2]C) -> 0 | DO19: =SUM(R[-13]C:R[-2]C) -> 0 | DP19: =SUM(R[-13]C:R[-2]C) -> 0 | DQ19: =SUM(R[-13]C:R[-2]C) -> 0 | DR19: =SUM(R[-13]C:R[-2]C) -> 0 | DS19: =SUM(R[-13]C:R[-2]C) -> 0 | DT19: =SUM(R[-13]C:R[-2]C) -> 0 | DU19: =SUM(R[-13]C:R[-2]C) -> 0 | DV19: =SUM(R[-13]C:R[-2]C) -> 0 | DW19: =SUM(R[-13]C:R[-2]C) -> 0 | DX19: =SUM(R[-13]C:R[-2]C) -> 0 | DY19: =SUM(R[-13]C:R[-2]C) -> 0 | DZ19: =SUM(R[-13]C:R[-2]C) -> 0 | EA19: =SUM(R[-13]C:R[-2]C) -> 0 | EB19: =SUM(R[-13]C:R[-2]C) -> 0 | EC19: =SUM(R[-13]C:R[-2]C) -> 0 | ED19: =SUM(R[-13]C:R[-2]C) -> 0 | EE19: =SUM(R[-13]C:R[-2]C) -> 0 | EF19: =SUM(R[-13]C:R[-2]C) -> 0 | EG19: =SUM(R[-13]C:R[-2]C) -> 0 | EH19: =SUM(R[-13]C:R[-2]C) -> 0 | EI19: =SUM(R[-13]C:R[-2]C) -> 0 | EJ19: =SUM(R[-13]C:R[-2]C) -> 0 | EK19: =SUM(R[-13]C:R[-2]C) -> 0 | EL19: =SUM(R[-13]C:R[-2]C) -> 0 | EM19: =SUM(R[-13]C:R[-2]C) -> 0 | EN19: =SUM(R[-13]C:R[-2]C) -> 0 | EO19: =SUM(R[-13]C:R[-2]C) -> 0 | EP19: =SUM(R[-13]C:R[-2]C) -> 0 | EQ19: =SUM(R[-13]C:R[-2]C) -> 0 | ER19: =SUM(R[-13]C:R[-2]C) -> 0 | ES19: =SUM(R[-13]C:R[-2]C) -> 0 | ET19: =SUM(R[-13]C:R[-2]C) -> 0 | EU19: =SUM(R[-13]C:R[-2]C) -> 0 | EV19: =SUM(R[-13]C:R[-2]C) -> 0 | EW19: =SUM(R[-13]C:R[-2]C) -> 0 | EX19: =SUM(R[-13]C:R[-2]C) -> 0 | EY19: =SUM(R[-13]C:R[-2]C) -> 0 | EZ19: =SUM(R[-13]C:R[-2]C) -> 0 | FA19: =SUM(R[-13]C:R[-2]C) -> 0 | FB19: =SUM(R[-13]C:R[-2]C) -> 0 | FC19: =SUM(R[-13]C:R[-2]C) -> 0 | FD19: =SUM(R[-13]C:R[-2]C) -> 0 | FE19: =SUM(R[-13]C:R[-2]C) -> 0 | FF19: =SUM(R[-13]C:R[-2]C) -> 0 | FG19: =SUM(R[-13]C:R[-2]C) -> 0 | FH19: =SUM(R[-13]C:R[-2]C) -> 0 | FI19: =SUM(R[-13]C:R[-2]C) -> 0 | FJ19: =SUM(R[-13]C:R[-2]C) -> 0 | FK19: =SUM(R[-13]C:R[-2]C) -> 0 | FL19: =SUM(R[-13]C:R[-2]C) -> 0 | FM19: =SUM(R[-13]C:R[-2]C) -> 0 | FN19: =SUM(R[-13]C:R[-2]C) -> 0 | FO19: =SUM(R[-13]C:R[-2]C) -> 0 | FP19: =SUM(R[-13]C:R[-2]C) -> 0 | FQ19: =SUM(R[-13]C:R[-2]C) -> 0 | FR19: =SUM(R[-13]C:R[-2]C) -> 0 | FS19: =SUM(R[-13]C:R[-2]C) -> 0 | FT19: =SUM(R[-13]C:R[-2]C) -> 0 | FU19: =SUM(R[-13]C:R[-2]C) -> 0 | FV19: =SUM(R[-13]C:R[-2]C) -> 0 | FW19: =SUM(R[-13]C:R[-2]C) -> 0 | FX19: =SUM(R[-13]C:R[-2]C) -> 0 | FY19: =SUM(R[-13]C:R[-2]C) -> 0 | FZ19: =SUM(R[-13]C:R[-2]C) -> 0 | GA19: =SUM(R[-13]C:R[-2]C) -> 0 | GB19: =SUM(R[-13]C:R[-2]C) -> 0 | GC19: =SUM(R[-13]C:R[-2]C) -> 0 | GD19: =SUM(R[-13]C:R[-2]C) -> 0 | GE19: =SUM(R[-13]C:R[-2]C) -> 0 | GF19: =SUM(R[-13]C:R[-2]C) -> 0 | GG19: =SUM(R[-13]C:R[-2]C) -> 0 | GH19: =SUM(R[-13]C:R[-2]C) -> 0 | GI19: =SUM(R[-13]C:R[-2]C) -> 0 | GJ19: =SUM(R[-13]C:R[-2]C) -> 0 | GK19: =SUM(R[-13]C:R[-2]C) -> 0 | GL19: =SUM(R[-13]C:R[-2]C) -> 0 | GM19: =SUM(R[-13]C:R[-2]C) -> 0 | GN19: =SUM(R[-13]C:R[-2]C) -> 0 | GO19: =SUM(R[-13]C:R[-2]C) -> 0 | GP19: =SUM(R[-13]C:R[-2]C) -> 0 | GQ19: =SUM(R[-13]C:R[-2]C) -> 0 | GR19: =SUM(R[-13]C:R[-2]C) -> 0 | GS19: =SUM(R[-13]C:R[-2]C) -> 0 | GT19: =SUM(R[-13]C:R[-2]C) -> 0 | GU19: =SUM(R[-13]C:R[-2]C) -> 0 | GV19: =SUM(R[-13]C:R[-2]C) -> 0 | GW19: =SUM(R[-13]C:R[-2]C) -> 0 | GX19: =SUM(R[-13]C:R[-2]C) -> 0 | GY19: =SUM(R[-13]C:R[-2]C) -> 0 | GZ19: =SUM(R[-13]C:R[-2]C) -> 0 | HA19: =SUM(R[-13]C:R[-2]C) -> 0 | HB19: =SUM(R[-13]C:R[-2]C) -> 0 | HC19: =SUM(R[-13]C:R[-2]C) -> 0 | HD19: =SUM(R[-13]C:R[-2]C) -> 0 | HE19: =SUM(R[-13]C:R[-2]C) -> 0 | HF19: =SUM(R[-13]C:R[-2]C) -> 0 | HG19: =SUM(R[-13]C:R[-2]C) -> 0 | HH19: =SUM(R[-13]C:R[-2]C) -> 0 | HI19: =SUM(R[-13]C:R[-2]C) -> 0 | HJ19: =SUM(R[-13]C:R[-2]C) -> 0 | HK19: =SUM(R[-13]C:R[-2]C) -> 0 | HL19: =SUM(R[-13]C:R[-2]C) -> 0 | HM19: =SUM(R[-13]C:R[-2]C) -> 0 | HN19: =SUM(R[-13]C:R[-2]C) -> 0

Sheet: Cashflow
B1: Lender: | D1: ACME Bank
B2: Borrower: | D2: SB Seller | K2: BORROWER
B3: Administrative Agent: | D3: ACME
B4: Tranche: | D4: T001
B5: Cashflow As At: | D5: Oct 01, 2013 | I5: Funding Date: | J5: Sep 27, 2013
I6: Day Count: | K6: 360.5
B7: Loan Advanced: | D7: 0 | E7: Funding Rate: | G7: 0.04 | I7: Interest Adj. Total: | K7: 0
B8: Outstanding: | D8: 1005630.8162
B9: Lender's Commit.: | D9: 1
B10: Additional Recourse: | D10: 0.01 | H10: Makewhole:
B11: Additional Recourse Allocation: | D11: 0
B12: Additional Recourse Used: | D12: 0
B13: Additional Recourse Remaining: | D13: 0
C16: Opening | D16: Monthly | E16: Interest | F16: Principal | G16: Default | H16: Prepayment | I16: Closing | J16: Makewhole | K16: Recourse
C17: Principal Balance | D17: Payment | E17: Expense | F17: Reduction | I17: Principal Balance | K17: Utilized
A19: 0 | B19: 2013-09-01T00:00:00.000 | I19: 1035083.38
A20: 1 | B20: 2013-10-01T00:00:00.000 | C20: 1035083.38 | D20: 32793.53 | E20: 3340.9661999999998 | F20: 29452.5638 | G20: 0 | H20: 0 | I20: 1005630.8162 | J20: 0 | K20: 0
A21: 2 | B21: 2013-11-01T00:00:00.000 | C21: 1005630.8162 | D21: 32793.53 | E21: 3242.7910000000002 | F21: 29550.739000000001 | G21: 0 | H21: 0 | I21: 976080.07720000006 | J21: 0 | K21: 0
A22: 3 | B22: 2013-12-01T00:00:00.000 | C22: 976080.07720000006 | D22: 32793.53 | E22: 3144.2885000000001 | F22: 29649.2415 | G22: 0 | H22: 0 | I22: 946430.83570000005 | J22: 0 | K22: 0
A23: 4 | B23: 2014-01-01T00:00:00.000 | C23: 946430.83570000005 | D23: 32793.53 | E23: 3045.4576999999999 | F23: 29748.0723 | G23: 0 | H23: 0 | I23: 916682.76340000005 | J23: 0 | K23: 0
A24: 5 | B24: 2014-02-01T00:00:00.000 | C24: 916682.76340000005 | D24: 32793.53 | E24: 2946.2973999999999 | F24: 29847.232599999999 | G24: 0 | H24: 0 | I24: 886835.53079999995 | J24: 0 | K24: 0
A25: 6 | B25: 2014-03-01T00:00:00.000 | C25: 886835.53079999995 | D25: 32793.53 | E25: 2846.8067000000001 | F25: 29946.723300000001 | G25: 0 | H25: 0 | I25: 856888.8075 | J25: 0 | K25: 0
A26: 7 | B26: 2014-04-01T00:00:00.000 | C26: 856888.8075 | D26: 32793.53 | E26: 2746.9843000000001 | F26: 30046.545699999999 | G26: 0 | H26: 0 | I26: 826842.26179999998 | J26: 0 | K26: 0
A27: 8 | B27: 2014-05-01T00:00:00.000 | C27: 826842.26179999998 | D27: 32793.53 | E27: 2646.8290999999999 | F27: 30146.7009 | G27: 0 | H27: 0 | I27: 796695.56090000004 | J27: 0 | K27: 0
A28: 9 | B28: 2014-06-01T00:00:00.000 | C28: 796695.56090000004 | D28: 32793.53 | E28: 2546.3400999999999 | F28: 30247.189900000001 | G28: 0 | H28: 0 | I28: 766448.37100000004 | J28: 0 | K28: 0
A29: 10 | B29: 2014-07-01T00:00:00.000 | C29: 766448.37100000004 | D29: 32793.53 | E29: 2445.5160999999998 | F29: 30348.013900000002 | G29: 0 | H29: 0 | I29: 736100.35710000002 | J29: 0 | K29: 0
A30: 11 | B30: 2014-08-01T00:00:00.000 | C30: 736100.35710000002 | D30: 32793.53 | E30: 2344.3561 | F30: 30449.173900000002 | G30: 0 | H30: 0 | I30: 705651.18319999997 | J30: 0 | K30: 0
A31: 12 | B31: 2014-09-01T00:00:00.000 | C31: 705651.18319999997 | D31: 32793.53 | E31: 2242.8588 | F31: 30550.671200000001 | G31: 0 | H31: 0 | I31: 675100.51199999999 | J31: 0 | K31: 0
A32: 13 | B32: 2014-10-01T00:00:00.000 | C32: 675100.51199999999 | D32: 32793.53 | E32: 2141.0232999999998 | F32: 30652.506700000002 | G32: 0 | H32: 0 | I32: 644448.00529999996 | J32: 0 | K32: 0
A33: 14 | B33: 2014-11-01T00:00:00.000 | C33: 644448.00529999996 | D33: 32793.53 | E33: 2038.8483000000001 | F33: 30754.681700000001 | G33: 0 | H33: 0 | I33: 613693.3236 | J33: 0 | K33: 0
A34: 15 | B34: 2014-12-01T00:00:00.000 | C34: 613693.3236 | D34: 32793.53 | E34: 1936.3326 | F34: 30857.197400000001 | G34: 0 | H34: 0 | I34: 582836.12620000006 | J34: 0 | K34: 0
A35: 16 | B35: 2015-01-01T00:00:00.000 | C35: 582836.12620000006 | D35: 32793.53 | E35: 1833.4753000000001 | F35: 30960.054700000001 | G35: 0 | H35: 0 | I35: 551876.07149999996 | J35: 0 | K35: 0
A36: 17 | B36: 2015-02-01T00:00:00.000 | C36: 551876.07149999996 | D36: 32793.53 | E36: 1730.2751000000001 | F36: 31063.2549 | G36: 0 | H36: 0 | I36: 520812.81660000002 | J36: 0 | K36: 0
A37: 18 | B37: 2015-03-01T00:00:00.000 | C37: 520812.81660000002 | D37: 32793.53 | E37: 1626.731 | F37: 31166.798999999999 | G37: 0 | H37: 0 | I37: 489646.01760000002 | J37: 0 | K37: 0
A38: 19 | B38: 2015-04-01T00:00:00.000 | C38: 489646.01760000002 | D38: 32793.53 | E38: 1522.8416 | F38: 31270.688399999999 | G38: 0 | H38: 0 | I38: 458375.32919999998 | J38: 0 | K38: 0
A39: 20 | B39: 2015-05-01T00:00:00.000 | C39: 458375.32919999998 | D39: 32793.53 | E39: 1418.606 | F39: 31374.923999999999 | G39: 0 | H39: 0 | I39: 427000.40519999998 | J39: 0 | K39: 0
A40: 21 | B40: 2015-06-01T00:00:00.000 | C40: 427000.40519999998 | D40: 32793.53 | E40: 1314.0228999999999 | F40: 31479.507099999999 | G40: 0 | H40: 0 | I40: 395520.89809999999 | J40: 0 | K40: 0
A41: 22 | B41: 2015-07-01T00:00:00.000 | C41: 395520.89809999999 | D41: 32793.53 | E41: 1209.0912000000001 | F41: 31584.4388 | G41: 0 | H41: 0 | I41: 363936.45929999999 | J41: 0 | K41: 0
A42: 23 | B42: 2015-08-01T00:00:00.000 | C42: 363936.45929999999 | D42: 32793.53 | E42: 1103.8098 | F42: 31689.7202 | G42: 0 | H42: 0 | I42: 332246.73910000001 | J42: 0 | K42: 0
A43: 24 | B43: 2015-09-01T00:00:00.000 | C43: 332246.73910000001 | D43: 32793.53 | E43: 998.17740000000003 | F43: 31795.352599999998 | G43: 0 | H43: 0 | I43: 300451.38650000002 | J43: 0 | K43: 0
A44: 25 | B44: 2015-10-01T00:00:00.000 | C44: 300451.38650000002 | D44: 30525.97 | E44: 899.75139999999999 | F44: 29626.2186 | G44: 0 | H44: 0 | I44: 270825.1679 | J44: 0 | K44: 0
A45: 26 | B45: 2015-11-01T00:00:00.000 | C45: 270825.1679 | D45: 30525.97 | E45: 800.9973 | F45: 29724.972699999998 | G45: 0 | H45: 0 | I45: 241100.19519999999 | J45: 0 | K45: 0
A46: 27 | B46: 2015-12-01T00:00:00.000 | C46: 241100.19519999999 | D46: 29608.41 | E46: 704.97260000000006 | F46: 28903.437399999999 | G46: 0 | H46: 0 | I46: 212196.75779999999 | J46: 0 | K46: 0
A47: 28 | B47: 2016-01-01T00:00:00.000 | C47: 212196.75779999999 | D47: 14803.01 | E47: 657.97919999999999 | F47: 14145.0308 | G47: 0 | H47: 0 | I47: 198051.72700000001 | J47: 0 | K47: 0
A48: 29 | B48: 2016-02-01T00:00:00.000 | C48: 198051.72700000001 | D48: 14803.01 | E48: 610.82910000000004 | F48: 14192.180899999999 | G48: 0 | H48: 0 | I48: 183859.54610000001 | J48: 0 | K48: 0
A49: 30 | B49: 2016-03-01T00:00:00.000 | C49: 183859.54610000001 | D49: 14803.01 | E49: 563.52179999999998 | F49: 14239.4882 | G49: 0 | H49: 0 | I49: 169620.05790000001 | J49: 0 | K49: 0
A50: 31 | B50: 2016-04-01T00:00:00.000 | C50: 169620.05790000001 | D50: 11819.39 | E50: 526.00220000000002 | F50: 11293.3878 | G50: 0 | H50: 0 | I50: 158326.67009999999 | J50: 0 | K50: 0
A51: 32 | B51: 2016-05-01T00:00:00.000 | C51: 158326.67009999999 | D51: 10792.2 | E51: 491.78160000000003 | F51: 10300.4184 | G51: 0 | H51: 0 | I51: 148026.25169999999 | J51: 0 | K51: 0
A52: 33 | B52: 2016-06-01T00:00:00.000 | C52: 148026.25169999999 | D52: 10792.2 | E52: 457.4468 | F52: 10334.753199999999 | G52: 0 | H52: 0 | I52: 137691.49849999999 | J52: 0 | K52: 0
A53: 34 | B53: 2016-07-01T00:00:00.000 | C53: 137691.49849999999 | D53: 10792.2 | E53: 422.99770000000001 | F53: 10369.202300000001 | G53: 0 | H53: 0 | I53: 127322.2962 | J53: 0 | K53: 0
A54: 35 | B54: 2016-08-01T00:00:00.000 | C54: 127322.2962 | D54: 10792.2 | E54: 388.43369999999999 | F54: 10403.766299999999 | G54: 0 | H54: 0 | I54: 116918.52989999999 | J54: 0 | K54: 0
A55: 36 | B55: 2016-09-01T00:00:00.000 | C55: 116918.52989999999 | D55: 10792.2 | E55: 353.75439999999998 | F55: 10438.445599999999 | G55: 0 | H55: 0 | I55: 106480.0843 | J55: 0 | K55: 0
A56: 37 | B56: 2016-10-01T00:00:00.000 | C56: 106480.0843 | D56: 10792.2 | E56: 318.95960000000002 | F56: 10473.240400000001 | G56: 0 | H56: 0 | I56: 96006.843900000007 | J56: 0 | K56: 0
A57: 38 | B57: 2016-11-01T00:00:00.000 | C57: 96006.843900000007 | D57: 10792.2 | E57: 284.04880000000003 | F57: 10508.1512 | G57: 0 | H57: 0 | I57: 85498.6927 | J57: 0 | K57: 0
A58: 39 | B58: 2016-12-01T00:00:00.000 | C58: 85498.6927 | D58: 10792.2 | E58: 249.02160000000001 | F58: 10543.178400000001 | G58: 0 | H58: 0 | I58: 74955.514299999995 | J58: 0 | K58: 0
A59: 40 | B59: 2017-01-01T00:00:00.000 | C59: 74955.514299999995 | D59: 10792.2 | E59: 213.8777 | F59: 10578.3223 | G59: 0 | H59: 0 | I59: 64377.192000000003 | J59: 0 | K59: 0
A60: 41 | B60: 2017-02-01T00:00:00.000 | C60: 64377.192000000003 | D60: 5463.5 | E60: 196.37899999999999 | F60: 5267.1210000000001 | G60: 0 | H60: 0 | I60: 59110.071000000004 | J60: 0 | K60: 0
A61: 42 | B61: 2017-03-01T00:00:00.000 | C61: 59110.071000000004 | D61: 5463.5 | E61: 178.8219 | F61: 5284.6781000000001 | G61: 0 | H61: 0 | I61: 53825.392899999999 | J61: 0 | K61: 0
A62: 43 | B62: 2017-04-01T00:00:00.000 | C62: 53825.392899999999 | D62: 5463.5 | E62: 161.2063 | F62: 5302.2937000000002 | G62: 0 | H62: 0 | I62: 48523.099199999997 | J62: 0 | K62: 0
A63: 44 | B63: 2017-05-01T00:00:00.000 | C63: 48523.099199999997 | D63: 5463.5 | E63: 143.53200000000001 | F63: 5319.9679999999998 | G63: 0 | H63: 0 | I63: 43203.131200000003 | J63: 0 | K63: 0
A64: 45 | B64: 2017-06-01T00:00:00.000 | C64: 43203.131200000003 | D64: 5463.5 | E64: 125.7988 | F64: 5337.7012000000004 | G64: 0 | H64: 0 | I64: 37865.43 | J64: 0 | K64: 0
A65: 46 | B65: 2017-07-01T00:00:00.000 | C65: 37865.43 | D65: 5463.5 | E65: 108.0064 | F65: 5355.4935999999998 | G65: 0 | H65: 0 | I65: 32509.936399999999 | J65: 0 | K65: 0
A66: 47 | B66: 2017-08-01T00:00:00.000 | C66: 32509.936399999999 | D66: 5463.5 | E66: 90.154799999999994 | F66: 5373.3451999999997 | G66: 0 | H66: 0 | I66: 27136.591199999999 | J66: 0 | K66: 0
A67: 48 | B67: 2017-09-01T00:00:00.000 | C67: 27136.591199999999 | D67: 5463.5 | E67: 72.243600000000001 | F67: 5391.2564000000002 | G67: 0 | H67: 0 | I67: 21745.334800000001 | J67: 0 | K67: 0
A68: 49 | B68: 2017-10-01T00:00:00.000 | C68: 21745.334800000001 | D68: 5463.5 | E68: 54.272799999999997 | F68: 5409.2272000000003 | G68: 0 | H68: 0 | I68: 16336.107599999999 | J68: 0 | K68: 0
A69: 50 | B69: 2017-11-01T00:00:00.000 | C69: 16336.107599999999 | D69: 5463.5 | E69: 36.241999999999997 | F69: 5427.2579999999998 | G69: 0 | H69: 0 | I69: 10908.8496 | J69: 0 | K69: 0
A70: 51 | B70: 2017-12-01T00:00:00.000 | C70: 10908.8496 | D70: 5463.5 | E70: 18.151199999999999 | F70: 5445.3487999999998 | G70: 0 | H70: 0 | I70: 5463.5007999999998 | J70: 0 | K70: 0
A71: 52 | B71: 2018-01-01T00:00:00.000 | C71: 5463.5007999999998 | D71: 5463.5 | E71: 0 | F71: 5463.5 | G71: 0 | H71: 0 | I71: 8.0000000000000004E-4 | J71: 0 | K71: 0
D73: =SUM(R[-54]C:R[-2]C) -> 1096625.29 | E73: =SUM(R[-54]C:R[-2]C) -> 61541.910800000012 | F73: =SUM(R[-54]C:R[-2]C) -> 1035083.3792000002 | G73: =SUM(R[-54]C:R[-2]C) -> 0 | H73: =SUM(R[-54]C:R[-2]C) -> 0 | J73: =SUM(R[-54]C:R[-2]C) -> 0 | K73: =SUM(R[-54]C:R[-2]C) -> 0